{
  "generated": "2024-12-10T12:15:00+00:00",
  "target": "/mnt/windows",
  "profile": "quick",
  "scan_status": "partial",
  "infected_files": [],
  "definitions": {
    "main": {
      "file": "main.cvd",
      "version": "62",
      "build_time": "2024-12-05T14:54:00+00:00",
      "sig_count": 8715603,
      "age_days": 5,
      "parse_error": null
    },
    "daily": {
      "file": "daily.cld",
      "version": "27397",
      "build_time": "2024-12-09T10:00:00+00:00",
      "sig_count": 2104337,
      "age_days": 1,
      "parse_error": null
    },
    "bytecode": {
      "file": "bytecode.cvd",
      "version": "334",
      "build_time": "2024-11-20T09:00:00+00:00",
      "sig_count": 75,
      "age_days": 20,
      "parse_error": null
    }
  },
  "scan_scope": {
    "paths_scanned": [
      "/mnt/windows/Windows/System32"
    ],
    "paths_skipped": [
      "/mnt/windows/Windows/SysWOW64",
      "/mnt/windows/Windows/Temp",
      "/mnt/windows/Windows",
      "/mnt/windows/Users",
      "/mnt/windows/ProgramData",
      "/mnt/windows/Program Files",
      "/mnt/windows/Program Files (x86)"
    ],
    "directories_scanned": 1,
    "files_scanned": 12400,
    "total_bytes_scanned": 897000000,
    "recursion_enabled": true,
    "archives_scanned": false,
    "max_file_size": "20M",
    "max_scan_size": "50M",
    "include_system_directories": true,
    "estimate_note": "File/byte counts are estimates; exact totals unavailable due to clamscan --infected flag"
  },
  "scan_execution": {
    "scan_start_time": "2024-12-10T11:00:00+00:00",
    "scan_end_time": "2024-12-10T12:15:00+00:00",
    "duration_seconds": 4500.0,
    "infected_count": 0,
    "errors_encountered": 2,
    "files_skipped_due_to_errors": 2,
    "permission_denied_paths": [
      "/mnt/windows/Windows/System32/config/SYSTEM",
      "/mnt/windows/Windows/System32/config/SAM"
    ],
    "oom_killed": true,
    "analyze_only": false,
    "scan_status": "partial"
  },
  "coverage": {
    "system32_scanned": true,
    "syswow64_scanned": false,
    "windows_temp_scanned": false,
    "users_scanned": false,
    "appdata_scanned": false,
    "program_files_scanned": false,
    "program_files_x86_scanned": false,
    "programdata_scanned": false,
    "dirs_not_scanned": [
      "Windows/SysWOW64",
      "Windows/Temp",
      "Users",
      "Program Files",
      "Program Files (x86)",
      "ProgramData"
    ],
    "overall_estimate": "low"
  },
  "scan_gaps": {
    "skipped_files_count": 2,
    "skipped_paths": [
      "/mnt/windows/Windows/System32/config/SYSTEM",
      "/mnt/windows/Windows/System32/config/SAM"
    ],
    "size_limited_files": [],
    "error_paths": [],
    "permission_denied": [
      "/mnt/windows/Windows/System32/config/SYSTEM",
      "/mnt/windows/Windows/System32/config/SAM"
    ],
    "dirs_not_scanned": [
      "Windows/SysWOW64",
      "Windows/Temp",
      "Users",
      "Program Files",
      "Program Files (x86)",
      "ProgramData"
    ],
    "archives_skipped": "All archives not scanned",
    "archives_skipped_flag": true,
    "max_file_size": "20M",
    "max_scan_size": "50M"
  },
  "file_type_limitations": [
    "Only executable and script types scanned: .exe .dll .sys .bat .cmd .ps1 .vbs .js .jse .wsf .scr .pif .com .cpl .msi .hta .lnk",
    "Archive files (.zip .rar .7z .cab .tar etc.) are NOT unpacked and scanned",
    "PDF documents are NOT scanned",
    "Office documents (.doc .xls .ppt .docx etc.) are NOT scanned",
    "Macro-enabled documents are NOT scanned",
    "Data files and custom formats are NOT scanned"
  ],
  "heuristic_limitations": [
    "Zero-day malware (unknown to ClamAV database) CANNOT be detected",
    "Custom or targeted malware not matching any known signature CANNOT be detected",
    "Fileless malware (executing in memory with no on-disk presence) CANNOT be detected",
    "Behaviour-based threats (require runtime execution to manifest) CANNOT be detected",
    "Rootkits that hide files from the filesystem at the OS level CANNOT be detected",
    "Polymorphic or metamorphic malware with sufficient obfuscation may evade detection",
    "Encrypted payloads that have not yet been decrypted on disk CANNOT be scanned",
    "ClamAV is a general-purpose scanner — detection rates for Windows malware vary; a clean result is not a guarantee of no infection"
  ],
  "cross_module_correlation": {
    "persistence_log": null,
    "persistence_suspicious": 0,
    "service_analysis_log": null,
    "service_suspicious": 0,
    "device_manager_log": null,
    "device_problem_count": 0,
    "system_integrity_log": null,
    "system_integrity_verdict": null,
    "cross_module_flags": [],
    "unexplained_signals": []
  },
  "scan_confidence": {
    "level": "low",
    "score": 2,
    "max_score": 6,
    "reasons": [
      "Quick profile only scans executables/scripts — archive-based malware not scanned",
      "Scan was incomplete (OOM kill or partial coverage)",
      "Users directory was NOT scanned — user-space malware may be missed"
    ]
  },
  "miss_analysis": {
    "coverage_gaps": [
      "Directory not scanned: Windows/SysWOW64",
      "Directory not scanned: Windows/Temp",
      "Directory not scanned: Users",
      "Directory not scanned: Program Files",
      "Archive files not unpacked — malware delivered inside .zip/.rar/.cab not detected",
      "2 path(s) inaccessible (permission denied)"
    ],
    "file_type_limitations": [
      "Only executable and script types scanned: .exe .dll .sys .bat .cmd .ps1 .vbs .js .jse .wsf .scr .pif .com .cpl .msi .hta .lnk",
      "Archive files (.zip .rar .7z .cab .tar etc.) are NOT unpacked and scanned"
    ],
    "heuristic_limitations": [
      "Zero-day malware (unknown to ClamAV database) CANNOT be detected"
    ],
    "cross_module_flags": [],
    "unexplained_signals": [],
    "confidence_adjustment": "lowered"
  },
  "recommendations": [
    "Run a thorough scan for complete coverage: bootstrap run m18_clamav_scan -- --target <path> --profile thorough",
    "Scan missing directories individually: Windows/SysWOW64, Windows/Temp, Users, Program Files",
    "Overall scan confidence is LOW — consider a secondary scanner on a different platform before declaring the system clean"
  ]
}
